topic,mode,correctness,groundedness,completeness,coverage,source_consistency,rubric,present_sections,n_steps,n_sources,latency,stop_reason,comment
Agentic AI for customer support,agent_evaluator,3,5,1,2,5,3.2,1,6,8,47.01478600502014,revised_after_evaluation,"Ответ содержит точную информацию, соответствующую предоставленным источникам (особенно источнику №2), однако генерация обрывается на середине предложения ('Терминология варьируется от «генер'). Это критически снижает полноту ответа и делает его технически некорректным как законченный продукт. Фактическая часть верна и хорошо заземлена в источниках, но отсутствие завершения делает ответ непригодным для использования."
Graph RAG for enterprise knowledge systems,agent_evaluator,0,0,0,0,0,0.0,1,5,8,47.60632610321045,evaluator_accept,Evaluator did not return valid JSON.
LLM evaluation and process-aware metrics,agent_evaluator,5,5,4,5,5,4.8,2,6,8,38.62132000923157,revised_after_evaluation,"Ответ корректно использует предоставленные источники для определения и описания подходов к оценке LLM. Информация точно соответствует аннотациям. Однако не все источники (Long et al., 2024; Kurt Pehli̇vanoğlu et al., 2024) учтены, что снижает полноту обзора контекста. Структура ответа логична."
Tool-using language models in scientific search,agent_evaluator,0,0,0,0,0,0.0,2,6,8,62.1717267036438,revised_after_evaluation,Evaluator did not return valid JSON.
Retrieval-augmented generation in medicine,agent_evaluator,0,0,0,0,0,0.0,0,6,8,39.175519943237305,revised_after_evaluation,Evaluator did not return valid JSON.
Planning and reflection in LLM agents,agent_evaluator,0,0,0,0,0,0.0,0,6,8,54.36024618148804,revised_after_evaluation,"Поле 'Ответ' пустое, отсутствует текст для оценки. Критерии не могут быть применены, так как нет сгенерированного ответа для проверки на корректность, обоснованность источниками и полноту."
Human-in-the-loop AI systems,agent_evaluator,0,0,0,0,0,0.0,0,6,8,34.08823800086975,revised_after_evaluation,Evaluator did not return valid JSON.
Knowledge graphs for procedural reasoning,agent_evaluator,0,0,0,0,0,0.0,2,6,8,66.31895709037781,revised_after_evaluation,Evaluator did not return valid JSON.
