topic,mode,correctness,groundedness,completeness,coverage,source_consistency,rubric,present_sections,n_steps,n_sources,latency,stop_reason,comment
Agentic AI for customer support,agent_topk_5,5,5,1,2,5,3.6,1,4,8,21.25124192237854,final_answer_generated,"Ответ содержит точные определения, основанные на источниках [1] и [2], однако текст обрывается на полуслове ('вспом'), что критически снижает полноту ответа. Фактическая часть корректна и хорошо заземлена."
Graph RAG for enterprise knowledge systems,agent_topk_5,3,2,1,1,3,2.0,2,4,8,40.90122103691101,final_answer_generated,"Ответ содержит верное определение Graph RAG, однако текст обрывается на полуслове в разделе 'Основные подходы' (пункт 1). Это критически снижает полноту и покрытие требуемых полей. Хотя утверждения в начале не противоречат источникам, ответ не раскрывает конкретные подходы, описанные в предоставленных источниках (Zep, Conceptual Graph RAG, ACRIE), ограничиваясь лишь заголовком. Отсутствие ссылок на конкретные данные из источников снижает заземленность."
LLM evaluation and process-aware metrics,agent_topk_5,0,0,0,0,0,0.0,2,4,8,24.49750018119812,final_answer_generated,Evaluator did not return valid JSON.
Tool-using language models in scientific search,agent_topk_5,0,0,0,0,0,0.0,0,4,8,8.444476842880249,final_answer_generated,Evaluator did not return valid JSON.
Retrieval-augmented generation in medicine,agent_topk_5,0,0,0,0,0,0.0,0,4,8,5.550275087356567,final_answer_generated,"Поле 'Ответ' пустое. Предоставлен только список источников без текста ответа для оценки. Невозможно проверить корректность, обоснованность или полноту без контента ответа."
Planning and reflection in LLM agents,agent_topk_5,0,0,0,0,0,0.0,0,4,8,6.338332176208496,final_answer_generated,Evaluator did not return valid JSON.
Human-in-the-loop AI systems,agent_topk_5,0,0,0,0,0,0.0,0,4,8,5.151341199874878,final_answer_generated,Evaluator did not return valid JSON.
Knowledge graphs for procedural reasoning,agent_topk_5,0,0,0,0,0,0.0,0,4,8,6.360222101211548,final_answer_generated,Evaluator did not return valid JSON.
